{
  "$defs": {
    "ArtifactReference": {
      "additionalProperties": false,
      "properties": {
        "media_type": {
          "type": "string"
        },
        "path": {
          "$ref": "#/$defs/RepositoryPath"
        },
        "schema_version": {
          "$ref": "#/$defs/SchemaVersion"
        },
        "sha256": {
          "$ref": "#/$defs/Sha256Digest"
        }
      },
      "required": [
        "schema_version",
        "path",
        "sha256",
        "media_type"
      ],
      "type": "object"
    },
    "RepositoryPath": {
      "pattern": "^[A-Za-z0-9._/-]{1,1024}$",
      "type": "string"
    },
    "SchemaVersion": {
      "enum": [
        "v0"
      ],
      "type": "string"
    },
    "Sha256Digest": {
      "pattern": "^sha256:[0-9a-f]{64}$",
      "type": "string"
    },
    "StableId": {
      "pattern": "^[A-Za-z0-9][A-Za-z0-9._-]{0,127}$",
      "type": "string"
    }
  },
  "$id": "urn:ls:repository-engineering:schema:v0:implementation-subject-manifest",
  "$schema": "https://json-schema.org/draft/2020-12/schema",
  "additionalProperties": false,
  "properties": {
    "conformance_corpus": {
      "$ref": "#/$defs/ArtifactReference"
    },
    "executor": {
      "$ref": "#/$defs/ArtifactReference"
    },
    "role_bundle": {
      "$ref": "#/$defs/ArtifactReference"
    },
    "runtime_bundle": {
      "$ref": "#/$defs/ArtifactReference"
    },
    "scenario_catalog": {
      "$ref": "#/$defs/ArtifactReference"
    },
    "schema_registry": {
      "$ref": "#/$defs/ArtifactReference"
    },
    "schema_version": {
      "$ref": "#/$defs/SchemaVersion"
    },
    "source_artifacts": {
      "items": {
        "$ref": "#/$defs/ArtifactReference"
      },
      "type": "array"
    },
    "subject_id": {
      "$ref": "#/$defs/StableId"
    }
  },
  "required": [
    "schema_version",
    "subject_id",
    "executor",
    "role_bundle",
    "runtime_bundle",
    "scenario_catalog",
    "source_artifacts",
    "schema_registry",
    "conformance_corpus"
  ],
  "title": "ImplementationSubjectManifest",
  "type": "object"
}
