{
  "schema_version": "v0",
  "subject_id": "audit-carried-rows",
  "executor": {
    "schema_version": "v0",
    "path": ".repository-engineering/executors/audit-carried-rows.toml",
    "sha256": "sha256:c05f380924e0daf3e10274a003bef676a2d3c542fc7421c70251ee76ff2c6775",
    "media_type": "application/toml"
  },
  "role_bundle": {
    "schema_version": "v0",
    "path": ".repository-engineering/roles/decommission-row-auditor.toml",
    "sha256": "sha256:740364c7e24919fffaa6dc521b161ab2c9f87b5bf0ecd107f688f7b51bb8aa60",
    "media_type": "application/toml"
  },
  "runtime_bundle": {
    "schema_version": "v0",
    "path": ".repository-engineering/runtime-bundle.json",
    "sha256": "sha256:09144e4eb99e3c9a7e7ef05a424e55291ce2331cab790df153950fa9543d4575",
    "media_type": "application/json"
  },
  "scenario_catalog": {
    "schema_version": "v0",
    "path": ".repository-engineering/scenarios/audit-carried-rows/implementation.toml",
    "sha256": "sha256:b4b3009f5350a2262bd634893f852f8d5e8417fb92546bdc4945a0dea25e932c",
    "media_type": "application/toml"
  },
  "source_artifacts": [
    {
      "schema_version": "v0",
      "path": ".agents/skills/audit-carried-rows/SKILL.md",
      "sha256": "sha256:af73dd9d0ed8eaed9d6de01722a8106c4ac5f69f5de5a1a2b6aacb90317c7572",
      "media_type": "text/markdown"
    },
    {
      "schema_version": "v0",
      "path": ".agents/skills/audit-carried-rows/references/record-format.md",
      "sha256": "sha256:00139d0dc6eb954777998162ef824f401f486cadf8603ef620349efbcb0f7a1b",
      "media_type": "text/markdown"
    },
    {
      "schema_version": "v0",
      "path": ".agents/skills/audit-row/SKILL.md",
      "sha256": "sha256:f74a93661cd3956c879834ee18114f955addf2daab04ec16dca0e4500084a10a",
      "media_type": "text/markdown"
    },
    {
      "schema_version": "v0",
      "path": ".claude/agents/decommission-row-auditor.md",
      "sha256": "sha256:770352bab0259ab636c42e8cc75df47db134536deade7c77c6ec107d449b5f3d",
      "media_type": "text/markdown"
    },
    {
      "schema_version": "v0",
      "path": "crates/ls-trackers/tests/decommission_audit.rs",
      "sha256": "sha256:7c943993cd0c5bf197baf7a3c9e78ceb6e5306b60a22379910f503c6f82c7ffe",
      "media_type": "text/x-rust"
    },
    {
      "schema_version": "v0",
      "path": "docs/migration-source/audit/manifest.yaml",
      "sha256": "sha256:2c72d2cdd3e86c72b153732f516c866542328b4d72e8ed70e51b2a64cfbe32bf",
      "media_type": "application/yaml"
    }
  ],
  "schema_registry": {
    "schema_version": "v0",
    "path": ".repository-engineering/schema-registry.json",
    "sha256": "sha256:fd9fc965b8c09b830b2c511a651349c63067d97e9f46c11362cce11b6a02fcce",
    "media_type": "application/json"
  },
  "conformance_corpus": {
    "schema_version": "v0",
    "path": ".repository-engineering/conformance/v0/manifest.json",
    "sha256": "sha256:0492da71c754bf5254ac1d299839ce26d1739cf99590006a64101f445f54819b",
    "media_type": "application/json"
  }
}
